Title,Template
Spoke with Owner,Called and spoke with Owner and informed them that pet was dropped off at Clinic and is now ready to be picked up.
Left a Voice Message,Called and had to leave a message for the pets Owner informing them that their pet is at the Clinic and is now ready to be picked up.
Was unable to leave a voice message,| -he- Called Owner and attempted to leave a voicemail - voice mail box was full however and so I was unable to. Will attempt to reach out to Owner again before Care Center's closing
Had to send a text,"| -he- Was unable to reach owner by phone so I sent a text  to the listed number on the order page, informing them of the pets drop off."
Talk Desk Message,Informing PP of pet being dropped off at Clinic